{
  "type": "accommodation",
  "id": "das123",
  "from": "2020-03-04",
  "to": "2020-05-06",
  "name": "name",
  "rooms": [
    {
      "guests": [
        {
          "first_name": "czesiek"
        }
      ],
      "type": "standard",
      "adults": 2,
      "children": null
    }
  ],
  "refund_policy": "fully refundable",
  "hotel_address": {
    "city": "Tel Aviv-Yafo",
    "postal_code": "6340506",
    "street": "Ha-Yarkon St 205",
    "country": "IL"
  },
  "rating": {
    "value": 4.5,
    "reviews": 2342
  },
  "meal_plan": "full board",
  "price": {
    "amount": "132.21",
    "currency": "PLN"
  },
  "extra_data": null
}
